{
  "id": "gaudi_mosaic",
  "name": "Gaudi Mosaic",
  "description": "Colorful and artistic inspired by trencadis mosaics",
  "preview_colors": ["#2D6A4F", "#E07A5F", "#F4D35E"],
  "is_default": false,
  "colors": {
    "primary_color": "#2D6A4F",
    "secondary_color": "#E07A5F",
    "accent_color": "#F4D35E",
    "background_color": "#FFFBF5",
    "text_color": "#2D3436",
    "header_background_color": "#ffffff",
    "header_text_color": "#2D3436",
    "footer_background_color": "#264653",
    "footer_text_color": "#E9ECEF",
    "light_color": "#FFFBF5",
    "link_color": "#2D6A4F",
    "action_color": "#2D6A4F"
  }
}
