{
  "id": "atlantic_blue",
  "name": "Atlantic Blue",
  "description": "Deep ocean blues with golden sunset accents",
  "preview_colors": [
    "#0C4A6E",
    "#D97706",
    "#FBBF24"
  ],
  "is_default": true,
  "colors": {
    "primary_color": "#0C4A6E",
    "secondary_color": "#D97706",
    "accent_color": "#FBBF24",
    "background_color": "#FAFAF9",
    "text_color": "#1C1917",
    "header_background_color": "#0C4A6E",
    "header_text_color": "#FFFFFF",
    "footer_background_color": "#082F49",
    "footer_text_color": "#F5F5F4",
    "link_color": "#0C4A6E",
    "card_background_color": "#ffffff",
    "card_text_color": "#1C1917",
    "border_color": "#e5e7eb",
    "surface_color": "#ffffff",
    "surface_alt_color": "#f9fafb",
    "success_color": "#10b981",
    "warning_color": "#f59e0b",
    "error_color": "#ef4444",
    "muted_text_color": "#6b7280",
    "link_hover_color": "#002448"
  }
}
