{
  "id": "coastal_elegance",
  "name": "Coastal Elegance",
  "description": "Refined navy with sandy beige accents",
  "preview_colors": ["#1E3A8A", "#B8903C", "#E8DCC4"],
  "is_default": false,
  "colors": {
    "primary_color": "#1E3A8A",
    "secondary_color": "#B8903C",
    "accent_color": "#E8DCC4",
    "background_color": "#FEFEFE",
    "text_color": "#1E293B",
    "header_background_color": "#1E3A8A",
    "header_text_color": "#FFFFFF",
    "footer_background_color": "#1E293B",
    "footer_text_color": "#E2E8F0",
    "light_color": "#F8FAFC",
    "link_color": "#1E3A8A",
    "action_color": "#B8903C"
  }
}
