{
  "id": "catalan_classic",
  "name": "Catalan Classic",
  "description": "Mediterranean blues with warm terracotta accents",
  "preview_colors": ["#0B5394", "#B8503E", "#E5B45A"],
  "is_default": true,
  "colors": {
    "primary_color": "#0B5394",
    "secondary_color": "#B8503E",
    "accent_color": "#E5B45A",
    "background_color": "#FEFCF9",
    "text_color": "#2D3436",
    "header_background_color": "#ffffff",
    "header_text_color": "#2D3436",
    "footer_background_color": "#1a365d",
    "footer_text_color": "#E2E8F0",
    "light_color": "#FEFCF9",
    "link_color": "#0B5394",
    "action_color": "#0B5394"
  }
}
