{
  "id": "azure_prestige",
  "name": "Azure Prestige",
  "description": "Sophisticated waterfront luxury appeal",
  "preview_colors": [
    "#1E3A5F",
    "#FAFAFA",
    "#CD7F32"
  ],
  "is_default": false,
  "colors": {
    "primary_color": "#1E3A5F",
    "secondary_color": "#CD7F32",
    "accent_color": "#4A90A4",
    "background_color": "#FAFAFA",
    "text_color": "#1E293B",
    "header_background_color": "#1E3A5F",
    "header_text_color": "#FFFFFF",
    "footer_background_color": "#1E3A5F",
    "footer_text_color": "#E2E8F0",
    "link_color": "#1E3A5F",
    "card_background_color": "#ffffff",
    "card_text_color": "#1E293B",
    "border_color": "#e5e7eb",
    "surface_color": "#ffffff",
    "surface_alt_color": "#f9fafb",
    "success_color": "#10b981",
    "warning_color": "#f59e0b",
    "error_color": "#ef4444",
    "muted_text_color": "#6b7280",
    "link_hover_color": "#001439"
  }
}
