{
  "id": "storm_gray",
  "name": "Storm Gray",
  "description": "Dramatic coastal moods with modern edge",
  "preview_colors": [
    "#475569",
    "#FFFFFF",
    "#0EA5E9"
  ],
  "is_default": false,
  "colors": {
    "primary_color": "#475569",
    "secondary_color": "#1E293B",
    "accent_color": "#0EA5E9",
    "background_color": "#FFFFFF",
    "text_color": "#1E293B",
    "header_background_color": "#FFFFFF",
    "header_text_color": "#1E293B",
    "footer_background_color": "#1E293B",
    "footer_text_color": "#CBD5E1",
    "link_color": "#475569",
    "card_background_color": "#ffffff",
    "card_text_color": "#1E293B",
    "border_color": "#e5e7eb",
    "surface_color": "#ffffff",
    "surface_alt_color": "#f9fafb",
    "success_color": "#10b981",
    "warning_color": "#f59e0b",
    "error_color": "#ef4444",
    "muted_text_color": "#6b7280",
    "link_hover_color": "#212f43"
  }
}
