{
  "id": "forest_green",
  "name": "Forest Green",
  "description": "Fresh, natural, and eco-friendly",
  "preview_colors": [
    "#27ae60",
    "#2c3e50",
    "#f39c12"
  ],
  "is_default": false,
  "colors": {
    "primary_color": "#27ae60",
    "secondary_color": "#2c3e50",
    "accent_color": "#f39c12",
    "background_color": "#ffffff",
    "text_color": "#333333",
    "header_background_color": "#ffffff",
    "header_text_color": "#333333",
    "footer_background_color": "#2c3e50",
    "footer_text_color": "#ffffff",
    "link_color": "#27ae60",
    "card_background_color": "#ffffff",
    "card_text_color": "#333333",
    "border_color": "#e5e7eb",
    "surface_color": "#ffffff",
    "surface_alt_color": "#f9fafb",
    "success_color": "#10b981",
    "warning_color": "#f59e0b",
    "error_color": "#ef4444",
    "muted_text_color": "#6b7280",
    "link_hover_color": "#01883a"
  }
}
