{
  "id": "lime_green",
  "name": "Lime Green",
  "description": "Fresh lime green - the signature Brussels look with Material Design influences",
  "preview_colors": [
    "#9ACD32",
    "#131313",
    "#616161"
  ],
  "is_default": true,
  "colors": {
    "primary_color": "#9ACD32",
    "secondary_color": "#131313",
    "accent_color": "#9FCB00",
    "background_color": "#FAFAFA",
    "text_color": "#212121",
    "header_background_color": "rgba(19, 19, 19, 0.52)",
    "header_text_color": "#FFFFFF",
    "footer_background_color": "#616161",
    "footer_text_color": "#FFFFFF",
    "link_color": "#9ACD32",
    "card_background_color": "#FFFFFF",
    "card_text_color": "#212121",
    "border_color": "#E0E0E0",
    "surface_color": "#FFFFFF",
    "surface_alt_color": "#F5F5F5",
    "success_color": "#9ACD32",
    "warning_color": "#FF9800",
    "error_color": "#F44336",
    "muted_text_color": "#757575",
    "link_hover_color": "#7CB342"
  }
}
