{
  "id": "sunset_orange",
  "name": "Sunset Orange",
  "description": "Warm, inviting, and creative",
  "preview_colors": [
    "#e67e22",
    "#2c3e50",
    "#9b59b6"
  ],
  "is_default": false,
  "colors": {
    "primary_color": "#e67e22",
    "secondary_color": "#2c3e50",
    "accent_color": "#9b59b6",
    "background_color": "#ffffff",
    "text_color": "#333333",
    "header_background_color": "#ffffff",
    "header_text_color": "#333333",
    "footer_background_color": "#2c3e50",
    "footer_text_color": "#ffffff",
    "link_color": "#e67e22",
    "card_background_color": "#ffffff",
    "card_text_color": "#333333",
    "border_color": "#e5e7eb",
    "surface_color": "#ffffff",
    "surface_alt_color": "#f9fafb",
    "success_color": "#10b981",
    "warning_color": "#f59e0b",
    "error_color": "#ef4444",
    "muted_text_color": "#6b7280",
    "link_hover_color": "#c05800"
  }
}
